--
-- this test verifies the gp_expand_get_status() function with simulated
-- gpexpand status files and schema tables.
--
-- start_ignore
CREATE LANGUAGE plpythonu;
-- end_ignore
-- check that real world gpexpand is not in progress
\! test -e $MASTER_DATA_DIRECTORY/gpexpand.status; echo $?;
1
\! test -e $MASTER_DATA_DIRECTORY/gpexpand.phase2.status; echo $?;
1
-- prepare two databases, gpexpand1 contains the simulated gpexpand schema
DROP database IF EXISTS gpexpand1;
DROP database IF EXISTS gpexpand2;
CREATE DATABASE gpexpand1;
CREATE DATABASE gpexpand2;
-- execute query in gpexpand1
CREATE OR REPLACE FUNCTION query_gpexpand1(sql text) RETURNS void AS $$
    import pygresql.pg as pg
    db = pg.connect(dbname='gpexpand1')
    db.query(sql)
$$ LANGUAGE plpythonu VOLATILE;
-- get gpexpand status by connect to both gpexpand1 and gpexpand2
CREATE OR REPLACE FUNCTION get_all_status(out db text, out code integer, out status text, out detail text)
RETURNS setof record AS $$
    import pygresql.pg as pg
    db1 = pg.connect(dbname='gpexpand1')
    db2 = pg.connect(dbname='gpexpand2')
    sql1 = '''select 'gpexpand1' as db, * from gp_expand_get_status()'''
    sql2 = '''select 'gpexpand2' as db, * from gp_expand_get_status()'''
    return db1.query(sql1).getresult() + db2.query(sql2).getresult()
$$ LANGUAGE plpythonu VOLATILE;
-- the status can only be queried on master, so below query should fail
select gp_expand_get_status() from gp_dist_random('gp_id');
ERROR:  function with EXECUTE ON restrictions cannot be used in the SELECT list of a query with FROM
-- phase0: neither status file nor status schema exist
select * from get_all_status();
    db     | code |    status     | detail 
-----------+------+---------------+--------
 gpexpand1 |    0 | NOT EXPANSION | 
 gpexpand2 |    0 | NOT EXPANSION | 
(2 rows)

-- phase1: as long as status file exists it is phase1, even if it is empty
\! touch $MASTER_DATA_DIRECTORY/gpexpand.status
select * from get_all_status();
    db     | code |        status         |       detail        
-----------+------+-----------------------+---------------------
 gpexpand1 |  114 | UNKNOWN_PHASE1_STATUS | invalid status file
 gpexpand2 |  114 | UNKNOWN_PHASE1_STATUS | invalid status file
(2 rows)

-- phase1: tolerate syntax error
\! echo 'INVALID FORMAT' >>$MASTER_DATA_DIRECTORY/gpexpand.status
select * from get_all_status();
    db     | code |        status         |       detail        
-----------+------+-----------------------+---------------------
 gpexpand1 |  114 | UNKNOWN_PHASE1_STATUS | invalid status file
 gpexpand2 |  114 | UNKNOWN_PHASE1_STATUS | invalid status file
(2 rows)

-- phase1: tolerate unknown status name
\! echo 'UNKNOWN PHASE1 STATUS:None' >>$MASTER_DATA_DIRECTORY/gpexpand.status
select * from get_all_status();
    db     | code |        status         | detail 
-----------+------+-----------------------+--------
 gpexpand1 |  114 | UNKNOWN_PHASE1_STATUS | None
 gpexpand2 |  114 | UNKNOWN_PHASE1_STATUS | None
(2 rows)

-- phase1: below are all known phase1 phase2 status names
\! echo 'UNINITIALIZED:None' >>$MASTER_DATA_DIRECTORY/gpexpand.status
select * from get_all_status();
    db     | code |    status     | detail 
-----------+------+---------------+--------
 gpexpand1 |  101 | UNINITIALIZED | None
 gpexpand2 |  101 | UNINITIALIZED | None
(2 rows)

\! echo 'EXPANSION_PREPARE_STARTED:<path> to inputfile' >>$MASTER_DATA_DIRECTORY/gpexpand.status
select * from get_all_status();
    db     | code |          status           |       detail        
-----------+------+---------------------------+---------------------
 gpexpand1 |  102 | EXPANSION_PREPARE_STARTED | <path> to inputfile
 gpexpand2 |  102 | EXPANSION_PREPARE_STARTED | <path> to inputfile
(2 rows)

\! echo 'BUILD_SEGMENT_TEMPLATE_STARTED:<path> to template dir' >>$MASTER_DATA_DIRECTORY/gpexpand.status
select * from get_all_status();
    db     | code |             status             |         detail         
-----------+------+--------------------------------+------------------------
 gpexpand1 |  103 | BUILD_SEGMENT_TEMPLATE_STARTED | <path> to template dir
 gpexpand2 |  103 | BUILD_SEGMENT_TEMPLATE_STARTED | <path> to template dir
(2 rows)

\! echo 'BUILD_SEGMENT_TEMPLATE_DONE:None' >>$MASTER_DATA_DIRECTORY/gpexpand.status
select * from get_all_status();
    db     | code |           status            | detail 
-----------+------+-----------------------------+--------
 gpexpand1 |  104 | BUILD_SEGMENT_TEMPLATE_DONE | None
 gpexpand2 |  104 | BUILD_SEGMENT_TEMPLATE_DONE | None
(2 rows)

\! echo 'BUILD_SEGMENTS_STARTED:<path> to schema tarball' >>$MASTER_DATA_DIRECTORY/gpexpand.status
select * from get_all_status();
    db     | code |         status         |          detail          
-----------+------+------------------------+--------------------------
 gpexpand1 |  105 | BUILD_SEGMENTS_STARTED | <path> to schema tarball
 gpexpand2 |  105 | BUILD_SEGMENTS_STARTED | <path> to schema tarball
(2 rows)

\! echo 'BUILD_SEGMENTS_DONE:1' >>$MASTER_DATA_DIRECTORY/gpexpand.status
select * from get_all_status();
    db     | code |       status        | detail 
-----------+------+---------------------+--------
 gpexpand1 |  106 | BUILD_SEGMENTS_DONE | 1
 gpexpand2 |  106 | BUILD_SEGMENTS_DONE | 1
(2 rows)

\! echo 'UPDATE_CATALOG_STARTED:<path> to gp_segment_configuration backup' >>$MASTER_DATA_DIRECTORY/gpexpand.status
select * from get_all_status();
    db     | code |         status         |                  detail                   
-----------+------+------------------------+-------------------------------------------
 gpexpand1 |  107 | UPDATE_CATALOG_STARTED | <path> to gp_segment_configuration backup
 gpexpand2 |  107 | UPDATE_CATALOG_STARTED | <path> to gp_segment_configuration backup
(2 rows)

\! echo 'UPDATE_CATALOG_DONE:None' >>$MASTER_DATA_DIRECTORY/gpexpand.status
select * from get_all_status();
    db     | code |       status        | detail 
-----------+------+---------------------+--------
 gpexpand1 |  108 | UPDATE_CATALOG_DONE | None
 gpexpand2 |  108 | UPDATE_CATALOG_DONE | None
(2 rows)

\! echo 'SETUP_EXPANSION_SCHEMA_STARTED:None' >>$MASTER_DATA_DIRECTORY/gpexpand.status
select * from get_all_status();
    db     | code |             status             | detail 
-----------+------+--------------------------------+--------
 gpexpand1 |  109 | SETUP_EXPANSION_SCHEMA_STARTED | None
 gpexpand2 |  109 | SETUP_EXPANSION_SCHEMA_STARTED | None
(2 rows)

-- phase1: it is still phase1 even if phase2 schema is created
select query_gpexpand1('
    create schema gpexpand;
    create table gpexpand.status (status text, updated timestamp);
    create table gpexpand.status_detail (
        dbname text,
        fq_name text,
        schema_oid oid,
        table_oid oid,
        distribution_policy smallint[],
        distribution_policy_names text,
        distribution_policy_coloids text,
        distribution_policy_type text,
        root_partition_name text,
        storage_options text,
        rank int,
        status text,
        expansion_started timestamp,
        expansion_finished timestamp,
        source_bytes numeric
    );
');
 query_gpexpand1 
-----------------
 
(1 row)

select * from get_all_status();
    db     | code |             status             | detail 
-----------+------+--------------------------------+--------
 gpexpand1 |  109 | SETUP_EXPANSION_SCHEMA_STARTED | None
 gpexpand2 |  109 | SETUP_EXPANSION_SCHEMA_STARTED | None
(2 rows)

\! echo 'SETUP_EXPANSION_SCHEMA_DONE:None' >>$MASTER_DATA_DIRECTORY/gpexpand.status
select * from get_all_status();
    db     | code |           status            | detail 
-----------+------+-----------------------------+--------
 gpexpand1 |  110 | SETUP_EXPANSION_SCHEMA_DONE | None
 gpexpand2 |  110 | SETUP_EXPANSION_SCHEMA_DONE | None
(2 rows)

\! echo 'PREPARE_EXPANSION_SCHEMA_STARTED:None' >>$MASTER_DATA_DIRECTORY/gpexpand.status
select * from get_all_status();
    db     | code |              status              | detail 
-----------+------+----------------------------------+--------
 gpexpand1 |  111 | PREPARE_EXPANSION_SCHEMA_STARTED | None
 gpexpand2 |  111 | PREPARE_EXPANSION_SCHEMA_STARTED | None
(2 rows)

-- phase1: it is still phase1 even if phase2 schema is filled
select query_gpexpand1('
    insert into gpexpand.status values ( ''SETUP'', ''01-01-01'' );
    insert into gpexpand.status_detail (dbname, fq_name, rank, status) values
      (''gpexpand1'', ''public.t1'', 2, ''NOT STARTED''),
      (''gpexpand1'', ''public.t2'', 2, ''NOT STARTED'');
    insert into gpexpand.status values ( ''SETUP DONE'', ''01-01-02'' );
');
 query_gpexpand1 
-----------------
 
(1 row)

select * from get_all_status();
    db     | code |              status              | detail 
-----------+------+----------------------------------+--------
 gpexpand1 |  111 | PREPARE_EXPANSION_SCHEMA_STARTED | None
 gpexpand2 |  111 | PREPARE_EXPANSION_SCHEMA_STARTED | None
(2 rows)

\! echo 'PREPARE_EXPANSION_SCHEMA_DONE:None' >>$MASTER_DATA_DIRECTORY/gpexpand.status
select * from get_all_status();
    db     | code |            status             | detail 
-----------+------+-------------------------------+--------
 gpexpand1 |  112 | PREPARE_EXPANSION_SCHEMA_DONE | None
 gpexpand2 |  112 | PREPARE_EXPANSION_SCHEMA_DONE | None
(2 rows)

\! echo 'EXPANSION_PREPARE_DONE:gpexpand1' >>$MASTER_DATA_DIRECTORY/gpexpand.status
select * from get_all_status();
    db     | code |         status         |  detail   
-----------+------+------------------------+-----------
 gpexpand1 |  113 | EXPANSION_PREPARE_DONE | gpexpand1
 gpexpand2 |  113 | EXPANSION_PREPARE_DONE | gpexpand1
(2 rows)

-- phase1: it is still phase1 even if phase2 status file exists
\! echo 'FAKE PHASE2 STATUS:still phase1' >>$MASTER_DATA_DIRECTORY/gpexpand.phase2.status
select * from get_all_status();
    db     | code |         status         |  detail   
-----------+------+------------------------+-----------
 gpexpand1 |  113 | EXPANSION_PREPARE_DONE | gpexpand1
 gpexpand2 |  113 | EXPANSION_PREPARE_DONE | gpexpand1
(2 rows)

-- phase2: no longer phase1 as long as phase1 status file is removed
-- - when connected to gpexpand1 the progress information is available
-- - when connected to other databases we can still know it is phase2
\! rm $MASTER_DATA_DIRECTORY/gpexpand.status
\! echo 'gpexpand1' > $MASTER_DATA_DIRECTORY/gpexpand.phase2.status
select * from get_all_status();
    db     | code |        status         |                                 detail                                 
-----------+------+-----------------------+------------------------------------------------------------------------
 gpexpand1 |  201 | SETUP DONE            | progress: 0 of 2 completed
 gpexpand2 |  205 | UNKNOWN PHASE2 STATUS | detailed phase2 information are only available in database "gpexpand1"
(2 rows)

select query_gpexpand1('
    insert into gpexpand.status values ( ''EXPANSION STARTED'', ''01-01-03'' );
    update gpexpand.status_detail set status=''COMPLETED''
     where fq_name=''public.t1'';
    insert into gpexpand.status values ( ''EXPANSION STOPPED'', ''01-01-04'' );
');
 query_gpexpand1 
-----------------
 
(1 row)

select * from get_all_status();
    db     | code |        status         |                                 detail                                 
-----------+------+-----------------------+------------------------------------------------------------------------
 gpexpand1 |  202 | EXPANSION STOPPED     | progress: 1 of 2 completed
 gpexpand2 |  205 | UNKNOWN PHASE2 STATUS | detailed phase2 information are only available in database "gpexpand1"
(2 rows)

select query_gpexpand1('
    insert into gpexpand.status values ( ''EXPANSION STARTED'', ''01-01-05'' );
    update gpexpand.status_detail set status=''COMPLETED''
     where fq_name=''public.t2'';
    insert into gpexpand.status values ( ''EXPANSION COMPLETE'', ''01-01-06'' );
');
 query_gpexpand1 
-----------------
 
(1 row)

select * from get_all_status();
    db     | code |        status         |                                 detail                                 
-----------+------+-----------------------+------------------------------------------------------------------------
 gpexpand1 |  204 | EXPANSION COMPLETE    | progress: 2 of 2 completed
 gpexpand2 |  205 | UNKNOWN PHASE2 STATUS | detailed phase2 information are only available in database "gpexpand1"
(2 rows)

-- phase2: it is still phase2 even if the schema is dropped
select query_gpexpand1('
    drop schema gpexpand cascade;
');
 query_gpexpand1 
-----------------
 
(1 row)

select * from get_all_status();
    db     | code |        status         |                                 detail                                 
-----------+------+-----------------------+------------------------------------------------------------------------
 gpexpand1 |  205 | UNKNOWN PHASE2 STATUS | detailed phase2 information are only available in database "gpexpand1"
 gpexpand2 |  205 | UNKNOWN PHASE2 STATUS | detailed phase2 information are only available in database "gpexpand1"
(2 rows)

-- phase0: it is phase0 again after phase2 status file is also removed
\! rm $MASTER_DATA_DIRECTORY/gpexpand.phase2.status
select * from get_all_status();
    db     | code |    status     | detail 
-----------+------+---------------+--------
 gpexpand1 |    0 | NOT EXPANSION | 
 gpexpand2 |    0 | NOT EXPANSION | 
(2 rows)

